study,name,title,author,year,abstract,cite,type,studies,url,doi
iab-soep-mig,9816,Menschen mit Migrationshintergrund zahlen elf Euro mehr Miete pro Monat,Tim Winke,2016,"Seit 2006 gilt in Deutschland das Allgemeine Gleichbehandlungsgesetz – auch für den Wohnungsmarkt. Die vorliegenden Berechnungen auf Basis des Sozio-oekonomischen Panels zeigen jedoch, dass Mieterinnen und Mieter mit Migrationshintergrund deutschlandweit im Jahr 2013 durchschnittlich knapp elf Euro höhere Mieten pro Monat zahlten als Haushalte ohne Migrationshintergrund. Und das, obwohl ihre Wohnungen im Schnitt über weniger Zimmer pro Personverfügten und in Nachbarschaften mit höherer Arbeitslosigkeit sowie geringerer Kaufkraft lagen. Mit Hilfe einer Dekompositionsmethode werden die empirischen Hintergründe der Mietpreisdifferenz aufgezeigt. Ein Teil dieser mietpreisbenachteiligung lässt sich so auf Faktoren wie kürzere Wohndauer und dem meist städtischen Kontext zurückzuführen. Trotz Berücksichtigung dieser strukturellen Wohnunterschiede bleibt ein Großteil der Mietpreisdifferenz jedoch statistisch unerklärt. Das Ergebnis deutet auf Einschränkungen beim Zugang zu günstigem Wohnraum für Menschen mit Migrationshintergrund hin. Bei direkter Befragung berichten Wohnungssuchende aus muslimischen Ländern und demehemaligen Jugoslawien besonders häufig von Diskriminierungserlebnissen. Eine Nachbesserung des Allgemeinen Gleichbehandlungsgesetzes und die Förderung einer Antidiskriminierungskultur im Wohnungsmarkt könnten Benachteiligungen vorbeugen und besonders im Hinblick auf die Integration von Geflüchteten sinnvoll sein.                               Since 2006, Germany’s General Act on Equal Treatment (Allgemeines Gleichbehandlungsgesetz, AGG) has been in effect – and the measure also includes tenants’ rights in the housing market. According to 2013 data from the Socio- Economic Panel, however, tenants with migration backgrounds were paying nearly 11 euros more per month, on average, than those without – even though their apartments averaged fewer rooms per person and tended to be in neighborhoods with higher unemployment levels and lower purchasing power. Using the decomposition method, this report illustrates the empirical background of the difference in rental prices. The differences can partially be attributed to the fact that people with migration backgrounds tend to be concentrated in urban areas and remain in their apartments for shorter amounts of time – but even when these structural differences are taken in account, the rental price difference remains unexplained at the statistical level. Our findings suggest that people with migration backgrounds are not always given access to favorable housing, and in a direct survey, apartment seekers from Muslim countries and former Yugoslavia were indeed more likely to report being discriminated against. Improving the AGG and promoting a culture of antidiscrimination in the housing market could prevent these patterns – a shift that is also of paramount importance when it comes to integrating refugees.","Tim Winke. 2016: Menschen mit Migrationshintergrund zahlen elf Euro mehr Miete pro Monat. DIW Wochenbericht 83 (47), 1133-1143",05 DIW Weekly Report,"SOEP v31, IAB-SOEP Migration Sample",http://www.diw.de/documents/publikationen/73/diw_01.c.547530.de/16-47-3.pdf,
iab-soep-mig,9847,"The Informed Consent to Record Linkage in Panel Studies: Optimal Starting Wave, Consent Refusals, and Subsequent Panel Attrition","Philipp Simon Eisnecker, Martin Kroh",2017,"Social scientists increasingly link survey data with administrative records. However, data protection legislation often requires respondents’ informed consent prior to record linkage. This has confronted research with nontrivial refusal rates in combination with selectivity of the consent decision. In longitudinal surveys, linkage requests may also increase attrition rates in subsequent waves, as many respondents perceive record linkages negatively. Hence, in panel surveys, both nonresponse forms potentially bias the resulting datasets. The present paper examines (a) whether we can minimize consent refusals in a longitudinal survey by varying which survey wave includes the linkage request and (b) whether such requests increase subsequent attrition. To test this, we implement a randomized survey experiment within a face-to-face household panel survey focusing on migrants in Germany. Respondents of the IAB-SOEP Migration Sample, conducted by the Institute for Employment Research (IAB) and the Socio-Economic Panel study (SOEP), were randomly allocated into three groups: first, a control group without record linkage; a second group that was asked in wave 1 (2013) to allow data linkage to administrative employment and benefits records held by the Federal Employment Agency; and a third group that was asked the same question in wave 2 (2014). We found neither significant differences in consent rates when introducing the request in wave 1 or 2 nor significant differences in panel attrition in subsequent waves. Therefore, results suggest that requesting consent to link records in wave 1 of a panel study provides the largest quantity of linked data without inflating panel attrition.","Philipp Simon Eisnecker, Martin Kroh. 2017: The Informed Consent to Record Linkage in Panel Studies: Optimal Starting Wave, Consent Refusals, and Subsequent Panel Attrition. Public Opinion Quarterly 81 (2), 131-143",02 SSCI Journal,IAB-SOEP Migration Sample,,10.1093/poq/nfw052
iab-soep-mig,9932,Investitionen in die Integration der Flüchtlinge lohnen sich,"Stefan Bach, Herbert Brücker, Peter Haan, Agnese Romiti, Kristina van Deuverden, Enzo Weber",2017,"Die Zuwanderung von Flüchtlingen verursacht zunächst erhebliche fiskalische Kosten. Mit zunehmender Integration in den Arbeitsmarkt verringern sich die laufenden Kosten und es entstehen zusätzliche Einnahmen für die öffentlichen Haushalte. Vor diesem Hintergrund haben IAB und DIW Berlin gemeinsam in einem vom Bundesministerium für Arbeit und Soziales finanzierten Forschungsprojekt untersucht, wie sich Investitionen in die Arbeitsmarktintegration der 2015 zugewanderten Flüchtlinge gesamtwirtschaftlich und fiskalisch auswirken können. Es zeigt sich, dass Investitionen in Sprachkompetenz und Bildungsabschlüsse der Flüchtlinge langfristig hohe Renditen erwarten lassen.                                         The initial fiscal costs associated with refugee integration are quite high – but as more and more refugees join the labor force, a reduction in ongoing welfare costs and an increase in government revenue will result. Against this background, the Institute for Employment Research (IAB) in Nuremberg and DIW Berlin conducted a joint investigation (funded by the German Federal Ministry of Labor and Social Affairs) on the overall economic and fiscal impacts of investing in the labor market integration of the refugees who arrived in Germany in 2015. The study shows that investing in refugees’ language skills and educational qualifications promise high returns.","Stefan Bach, Herbert Brücker, Peter Haan, Agnese Romiti, Kristina van Deuverden, Enzo Weber. 2017: Investitionen in die Integration der Flüchtlinge lohnen sich. DIW Wochenbericht 84 (3), 47-58",05 DIW Weekly Report,IAB-SOEP Migration Sample,http://diw.de/documents/publikationen/73/diw_01.c.550525.de/17-3-1.pdf,
iab-soep-mig,9946,Abschätzung von Effekten der Integration von Flüchtlingen: Kurzexpertise für das Bundesministerium für Arbeit und Soziales,"Stefan Bach, Peter Haan, Kristina van Deuverden, Björn Fischer, Herbert Brücker, Agnese Romiti, Enzo Weber",2017,,"Stefan Bach, Peter Haan, Kristina van Deuverden, Björn Fischer, Herbert Brücker, Agnese Romiti, Enzo Weber. 2017: Abschätzung von Effekten der Integration von Flüchtlingen: Kurzexpertise für das Bundesministerium für Arbeit und Soziales. DIW Berlin: Politikberatung kompakt Nr. 117. Berlin: DIW Berlin",35 Other DIW Publication,IAB-SOEP Migration Sample,http://diw.de/documents/publikationen/73/diw_01.c.550297.de/diwkompakt_2017-117.pdf,
iab-soep-mig,9951,Die Integration Geflüchteter – Erkenntnisse aus der Vergangenheit: Editorial,"Philipp Eisnecker, Johannes Giesecke, Martin Kroh, Elisabeth Liebau, Jan Marcus, Zerrin Salikutluk, Diana Schacht, C. Katharina Spieß, Franz Westermaier",2016,,"Philipp Eisnecker, Johannes Giesecke, Martin Kroh, Elisabeth Liebau, Jan Marcus, Zerrin Salikutluk, Diana Schacht, C. Katharina Spieß, Franz Westermaier. 2016: Die Integration Geflüchteter – Erkenntnisse aus der Vergangenheit: Editorial. DIW Wochenbericht 83 (35), 727-730",05 DIW Weekly Report,"SOEP v31, IAB-SOEP Migration Sample",http://diw.de/documents/publikationen/73/diw_01.c.541795.de/16-35-1.pdf,
iab-soep-mig,9952,Integrating Refugees: Insights from the Past: Editorial,"Philipp Eisnecker, Johannes Giesecke, Martin Kroh, Elisabeth Liebau, Jan Marcus, Zerrin Salikutluk, Diana Schacht, C. Katharina Spieß, Franz Westermaier",2016,,"Philipp Eisnecker, Johannes Giesecke, Martin Kroh, Elisabeth Liebau, Jan Marcus, Zerrin Salikutluk, Diana Schacht, C. Katharina Spieß, Franz Westermaier. 2016: Integrating Refugees: Insights from the Past: Editorial. DIW Economic Bulletin 6 (34+35), 387-390",05 DIW Weekly Report,"SOEP v31, IAB-SOEP Migration Sample",http://diw.de/documents/publikationen/73/diw_01.c.542004.de/diw_econ_bull_2016-34-1.pdf,
iab-soep-mig,9991,"Erhebungsinstrumente des IAB-SOEP-Migrationssamples 2016: Haushaltsfragebogen, Stichproben M1-M2",TNS Infratest Sozialforschung,2016,,"TNS Infratest Sozialforschung. 2016: Erhebungsinstrumente des IAB-SOEP-Migrationssamples 2016: Haushaltsfragebogen, Stichproben M1-M2. SOEP Survey Papers 357: Series A - Survey Instruments (Erhebungsinstrumente). Berlin: DIW Berlin",35 Other DIW Publication,SOEP-Core  IAB-SOEP Migration Sample,http://hdl.handle.net/10419/148954,
iab-soep-mig,9992,"Erhebungsinstrumente des IAB-SOEP-Migrationssamples 2016: Personenfragebogen (Wiederbefragte), Stichproben M1-M2",TNS Infratest Sozialforschung,2016,,"TNS Infratest Sozialforschung. 2016: Erhebungsinstrumente des IAB-SOEP-Migrationssamples 2016: Personenfragebogen (Wiederbefragte), Stichproben M1-M2. SOEP Survey Papers 358: Series A - Survey Instruments (Erhebungsinstrumente). Berlin: DIW Berlin",35 Other DIW Publication,SOEP-Core  IAB-SOEP Migration Sample,http://hdl.handle.net/10419/148955,
iab-soep-mig,9993,"Erhebungsinstrumente des IAB-SOEP-Migrationssamples 2016: Jugendfragebogen, Stichproben M1-M2",TNS Infratest Sozialforschung,2016,,"TNS Infratest Sozialforschung. 2016: Erhebungsinstrumente des IAB-SOEP-Migrationssamples 2016: Jugendfragebogen, Stichproben M1-M2. SOEP Survey Papers 359: Series A - Survey Instruments (Erhebungsinstrumente). Berlin: DIW Berlin",35 Other DIW Publication,SOEP-Core  IAB-SOEP Migration Sample,http://hdl.handle.net/10419/148956,
iab-soep-mig,9994,"Erhebungsinstrumente des IAB-SOEP-Migrationssamples 2016: Integrierter Personen- und Biografiefragebogen (Erstbefragte 2016), Stichproben M1-M2",TNS Infratest Sozialforschung,2016,,"TNS Infratest Sozialforschung. 2016: Erhebungsinstrumente des IAB-SOEP-Migrationssamples 2016: Integrierter Personen- und Biografiefragebogen (Erstbefragte 2016), Stichproben M1-M2. SOEP Survey Papers 360: Series A - Survey Instruments (Erhebungsinstrumente). Berlin: DIW Berlin",35 Other DIW Publication,SOEP-Core  IAB-SOEP Migration Sample,http://hdl.handle.net/10419/148957,
iab-soep-mig,10000,"Erhebungsinstrumente des IAB-SOEP-Migrationssamples 2015: Integrierter Personen-Biografiefragebogen, Stichprobe M1, Erstbefragte",TNS Infratest Sozialforschung,2016,,"TNS Infratest Sozialforschung. 2016: Erhebungsinstrumente des IAB-SOEP-Migrationssamples 2015: Integrierter Personen-Biografiefragebogen, Stichprobe M1, Erstbefragte. SOEP Survey Papers 366:  Series A - Survey Instruments (Erhebungsinstrumente). Berlin: DIW Berlin",35 Other DIW Publication,SOEP-Core  IAB-SOEP Migration Sample,http://hdl.handle.net/10419/148959,
iab-soep-mig,10001,"Erhebungsinstrumente des IAB-SOEP-Migrationssamples 2015: Haushaltsfragebogen, Stichprobe M1",TNS Infratest Sozialforschung,2016,,"TNS Infratest Sozialforschung. 2016: Erhebungsinstrumente des IAB-SOEP-Migrationssamples 2015: Haushaltsfragebogen, Stichprobe M1. SOEP Survey Papers 367:  Series A - Survey Instruments (Erhebungsinstrumente). Berlin: DIW Berlin",35 Other DIW Publication,SOEP-Core  IAB-SOEP Migration Sample,http://hdl.handle.net/10419/148960,
iab-soep-mig,10002,"Erhebungsinstrumente des IAB-SOEP-Migrationssamples 2015: Integrierter Personen-Biografiefragebogen, Stichprobe M2, Erstbefragte",TNS Infratest Sozialforschung,2016,,"TNS Infratest Sozialforschung. 2016: Erhebungsinstrumente des IAB-SOEP-Migrationssamples 2015: Integrierter Personen-Biografiefragebogen, Stichprobe M2, Erstbefragte. SOEP Survey Papers 368:  Series A - Survey Instruments (Erhebungsinstrumente). Berlin: DIW Berlin",35 Other DIW Publication,SOEP-Core  IAB-SOEP Migration Sample,http://hdl.handle.net/10419/148961,
iab-soep-mig,10003,"Erhebungsinstrumente des IAB-SOEP-Migrationssamples 2015: Haushaltsfragebogen, Stichprobe M2",TNS Infratest Sozialforschung,2016,,"TNS Infratest Sozialforschung. 2016: Erhebungsinstrumente des IAB-SOEP-Migrationssamples 2015: Haushaltsfragebogen, Stichprobe M2. SOEP Survey Papers 369:  Series A - Survey Instruments (Erhebungsinstrumente). Berlin: DIW Berlin",35 Other DIW Publication,SOEP-Core  IAB-SOEP Migration Sample,http://hdl.handle.net/10419/148962,
iab-soep-mig,10004,"Erhebungsinstrumente des IAB-SOEP-Migrationssamples 2015: Jugendfragebogen, Stichprobe M1",TNS Infratest Sozialforschung,2016,,"TNS Infratest Sozialforschung. 2016: Erhebungsinstrumente des IAB-SOEP-Migrationssamples 2015: Jugendfragebogen, Stichprobe M1. SOEP Survey Papers 370:  Series A - Survey Instruments (Erhebungsinstrumente). Berlin: DIW Berlin",35 Other DIW Publication,SOEP-Core  IAB-SOEP Migration Sample,http://hdl.handle.net/10419/148963,
iab-soep-mig,10069,The Request for Record Linkage in the IAB-SOEP Migration Sample,"Philipp Simon Eisnecker, Klaudia Erhardt, Martin Kroh, Parvati Trübswetter",2017,,"Philipp Simon Eisnecker, Klaudia Erhardt, Martin Kroh, Parvati Trübswetter. 2017: The Request for Record Linkage in the IAB-SOEP Migration Sample. SOEP Survey Papers 291: Series C - Data Documentations (Datendokumentationen). Berlin: DIW Berlin",36 Infratest Report,SOEP-Core  IAB-SOEP Migration Sample,http://hdl.handle.net/10419/156116,
iab-soep-mig,10122,"Erhebungsinstrumente des IAB-SOEP-Migrationssamples 2015: Personenfragebogen (Wiederbefragte), Stichprobe M1",TNS Infratest Sozialforschung,2017,,"TNS Infratest Sozialforschung. 2017: Erhebungsinstrumente des IAB-SOEP-Migrationssamples 2015: Personenfragebogen (Wiederbefragte), Stichprobe M1. SOEP Survey Papers 426: Series A - Survey Instruments (Erhebungsinstrumente). Berlin: DIW Berlin",35 Other DIW Publication,SOEP-Core  IAB-SOEP Migration Sample,http://panel.gsoep.de/soep-docs/surveypapers/diw_ssp0426.pdf,
iab-soep-mig,10133,"IAB-SOEP Migrationsstichprobe verknüpft mit administrativen Daten des IAB * Version 1 (IAB-SOEP-MIG-ADIAB 7514, Version 1)","Parvati Trübswetter, Tanja Fendel",2016,Dieser Datenreport beschreibt die verknüpften Befragungsdaten der IAB-SOEP Migrationsstichprobe mit administrativen Daten des Instituts für Arbeitsmarkt- und Berufsforschung (IAB).,"Parvati Trübswetter, Tanja Fendel. 2016: IAB-SOEP Migrationsstichprobe verknüpft mit administrativen Daten des IAB * Version 1 (IAB-SOEP-MIG-ADIAB 7514, Version 1). FDZ- Datenreport 11/2016. Nürnberg: Forschungsdatenzentrum (FDZ) der Bundesagentur für Arbeit (BA) im Institut für Arbeitsmarkt- und Berufsforschung (IAB)",33 Other Grey Literature,"IAB-SOEP, SOEP , SOEP-Core",http://doku.iab.de/fdz/reporte/2016/DR_11-16.pdf,
iab-soep-mig,10195,Erhebungsinstrumente des IAB-SOEP-Migrationssamples 2015: Übersetzungshilfen,TNS Infratest Sozialforschung,2017,,TNS Infratest Sozialforschung. 2017: Erhebungsinstrumente des IAB-SOEP-Migrationssamples 2015: Übersetzungshilfen. SOEP Survey Papers 427: Series A - Survey Instruments (Erhebungsinstrumente). Berlin: DIW Berlin,35 Other DIW Publication,"SOEP-Core,  IAB-SOEP Migration Sample",http://hdl.handle.net/10419/156111,
iab-soep-mig,10385,Economic analysis of migration flows to Germany focusing on Spanish emigrants,Paula  Morán Ramírez,2017,"This essay economically analyses the different international immigration flows Germany has experienced (with a special emphasis on Spanish population) since the end of World War II: guest workers period and post-financial crisis. Both waves are characterized by the contrasting educational level required by German employers according to the labor market needs. However, the language skills appear to be a key comparative advantage over other immigrants. For that purpose, an econometric analysis with German socio-economic panel data has been carried out in order to identify the potential requested skills for foreigners in the German labor market. The econometric models provide a justification to why this last migration wave –partly caused by an increasing globalization trend– is characterized by the importance of speaking and writing German very well in addition to the schooling level.",Paula  Morán Ramírez. 2017: Economic analysis of migration flows to Germany focusing on Spanish emigrants. Barcelona: University of Barcelona,41 B.A./M.A. Thesis,IAB-SOEP Migration Sample,,
iab-soep-mig,10403,Labour market integration of refugee’s in Germany: Is there evidence for a refugee gap?,Tim Jähnert,2017,"In this thesis, I examine the existence of a refugee gap in Germany. In more detail, I research the differences in net income and employment rate for immigrants with different motives for migration. In order to do that I use data from the IAB-SOEP Migration Sample which is a joint project from the Institute for Employment Research (IAB) and the Socio-Economic Panel (SOEP) at the German Institute for Economic Research (DIW Berlin). By employing that data, I have information about 4,964 persons with migration background residing in 2,723 households. The research is conducted by using a linear and a logistic regression model in order to underline the effects of the differences between different migration groups. I conclude that there is a small refugee gap in Germany.",Tim Jähnert. 2017: Labour market integration of refugee’s in Germany: Is there evidence for a refugee gap? Örebro: Örebro University,41 B.A./M.A. Thesis,IAB-SOEP Migration Sample,,
iab-soep-mig,10421,Refugee Integration: A Worthwile Investment,"Stefan Bach, Herbert Brücker, Peter Haan, Agnese Romiti, Kristina van Deuverden, Enzo Weber",2017,"The initial fiscal costs associated with refugee integration are quite high—but as more and more refugees join the labor force, a reduction in ongoing welfare costs and an increase in government revenue will result. Against this background, the Institute for Employment Research (IAB) in Nuremberg and DIW Berlin conducted a joint investigation (funded by the German Federal Ministry of Labor and Social Affairs) into the overall economic and fiscal impacts of investing in the labor market integration of the refugees who arrived in Germany in 2015. The results show that investing in refugees’ language skills and educational qualifications promises high returns.","Stefan Bach, Herbert Brücker, Peter Haan, Agnese Romiti, Kristina van Deuverden, Enzo Weber. 2017: Refugee Integration: A Worthwile Investment. DIW Economic Bulletin 7 (3+4), 33-43",05 DIW Weekly Report,IAB-SOEP Migration Sample,https://www.diw.de/documents/publikationen/73/diw_01.c.551747.de/diw_econ_bull_2017-03-1.pdf,
iab-soep-mig,10665,Substantial Labor Market Effects of the Residency Status: How Important are Initial Conditions At Arrival for Immigrants?,Eric Schuss,2017,"This paper uses information on the legal status upon arrival to study long-term labor market effects, whereas selection and potential outmigration are taken into account by a large set of methods. I find that immigrants arrived with a job commitment in Germany achieve a longterm income advantage of 18.6% relative to other migrant groups, while language skills and ethnic networks can be excluded as transmission channels. Thus, a better linkage between job vacancies in the host country and the labor supply of potential migrants in the home country prevents mismatches and unrealistic expectations of potential migrants towards the host country.",Eric Schuss. 2017: Substantial Labor Market Effects of the Residency Status: How Important are Initial Conditions At Arrival for Immigrants? SOEPpaper 952. Berlin: DIW Berlin,32 SOEPpaper,IAB-SOEP Migration Sample 2014,http://www.diw.de/documents/publikationen/73/diw_01.c.576045.de/diw_sp0952.pdf,
iab-soep-mig,10714,"The 2015 IAB-SOEP Migration Study M2: Sampling Design, Nonresponse, and Weighting Adjustment","Simon Kühne, Martin Kroh",2017,,"Simon Kühne, Martin Kroh. 2017: The 2015 IAB-SOEP Migration Study M2: Sampling Design, Nonresponse, and Weighting Adjustment. SOEP Survey Papers 473: Series C - Data Documentations (Datendokumentationen). Berlin: DIW Berlin",35 Other DIW Publication,SOEP-Core  IAB-SOEP Migration Sample,https://hdl.handle.net/10419/170486,
iab-soep-mig,10827,Measuring Migrants' Educational Attainment: The CAMCES Tool in the IAB-SOEP Migration Samples,"Silke L. Schneider, Roberto Briceno-Rosas, Verena Ortmanns, Jessica M. E. Herzing",2018,"Education is one of the most frequently used variables in social science research. However, it is challenging to measure educational attainment with a high degree of validity and comparability in migrant surveys. In migrant surveys, respondents were educated in various different educational systems. Rather than providing specific response options for the qualifications available in every country of origin, migrant surveys often use generic response options (such as “secondary education”) that supposedly work equally well for respondents educated in all kinds of educational systems. Given the lack of universal understanding of such generic categories, we have doubts whether this approach leads to reliable, valid, and comparable data. To improve the measurement of educational qualifications obtained abroad, GESIS has developed a new tool in the project ""Computer-assisted measurement and coding of education in surveys"" (CAMCES). In this paper, we present how migrants’ education is usually measured in the German IAB-SOEP Migration Samples and the alternative measurement using the CAMCES tool implemented in the IAB-SOEP Migration Samples 2015 and 2016. We analyze the coverage of educational systems in the CAMCES tool, compare the level of item nonresponse and non-coded responses affecting the standard and the CAMCES instruments, and examine the consistency of the resulting education variables. The paper concludes by discussing benefits and limitations of either measurement approach, and by giving an outlook of possible applications of the CAMCES tool....","Silke L. Schneider, Roberto Briceno-Rosas, Verena Ortmanns, Jessica M. E. Herzing. 2018: Measuring Migrants' Educational Attainment: The CAMCES Tool in the IAB-SOEP Migration Samples, in Dorothée Behr (ed^.), Surveying the Migrant Population: Consideration of Linguistic and Cultural Issues  (Gesis Schriftenreihe Band 19). Köln: Gesis - Leibniz-Institut für Sozialwissenschaften. 43-74",20 Book Section,IAB-SOEP Migration Sample,https://www.ssoar.info/ssoar/handle/document/58550,
iab-soep-mig,11131,SOEP-Metafile.do – ein Stata-Do-File zur Generierung eines Metafiles zu den SOEP-Daten,Klaudia Erhardt,2018,,Klaudia Erhardt. 2018: SOEP-Metafile.do – ein Stata-Do-File zur Generierung eines Metafiles zu den SOEP-Daten. SOEP Survey Papers 534: Series G - General Issues and Teaching Materials. Berlin: DIW Berlin / SOEP,35 Other DIW Publication,"SOEP-Core, IAB-SOEP Migration Sample",http://www.diw.de/documents/publikationen/73/diw_01.c.593344.de/diw_ssp0534.pdf,
iab-soep-mig,11145,Social Mobility and Perceived Discrimination: Adding an Intergenerational Perspective,Merlin Schaeffer,2019,"This article adds an intergenerational perspective to the study of perceived ethnic discrimination. It proposes the conjecture that perceived discrimination tends to increase with parental education, particularly among those children of immigrants who have attained only mediocre levels of education themselves. I discuss that this conjecture may be developed as an argument that comes in two versions: a narrow version about explicit downward (intergenerational) mobility and a wide version about unfulfilled mobility aspirations more generally. Analyses based on the six-country comparative EURISLAM survey support the argument: parental education positively predicts perceived discrimination in general, but among the less educated, this relation is most pronounced, whereas it is absent among those with tertiary education. A replication and falsification test based on the German IAB-SOEP Migration Sample reconfirms the main finding and provides further original pieces of evidence. The analyses suggest processes associated with unfulfilled mobility aspirations as the more plausible underlying reason.","Merlin Schaeffer. 2019: Social Mobility and Perceived Discrimination: Adding an Intergenerational Perspective. European Sociological Review 35 (1), 65-80",02 SSCI Journal,IAB-SOEP,,10.1093/esr/jcy042
