study,name,title,author,year,abstract,cite,type,studies,url,doi
iab-soep-mig,8628,The new IAB-SOEP Migration Sample: an introduction into the methodology and the contents,"Herbert Brücker, Martin Kroh, Simone Bartsch, Jan Goebel, Simon Kühne, Elisabeth Liebau, Parvati Trübswetter, Ingrid Tucci, Jürgen Schupp",2014,,"Herbert Brücker, Martin Kroh, Simone Bartsch, Jan Goebel, Simon Kühne, Elisabeth Liebau, Parvati Trübswetter, Ingrid Tucci, Jürgen Schupp. 2014: The new IAB-SOEP Migration Sample: an introduction into the methodology and the contents. SOEP Survey Papers 216: Series C. Berlin: DIW/SOEP",35 Other DIW Publication,SOEP-Core  IAB-SOEP Migration Sample,http://hdl.handle.net/10419/103964,
iab-soep-mig,8629,Methodenbericht zum IAB-SOEP-Migrationssample 2013,TNS Infratest Sozialforschung,2014,,TNS Infratest Sozialforschung. 2014: Methodenbericht zum IAB-SOEP-Migrationssample 2013. SOEP Survey Papers 217: Series B. Berlin: DIW/SOEP,35 Other DIW Publication,SOEP-Core  IAB-SOEP Migration Sample,http://hdl.handle.net/10419/103966,
iab-soep-mig,8630,"Erhebungsinstrumente des IAB-SOEP-Migrationssamples 2013: Integrierter Personen-Biografiefragebogen, Haushaltsfragebogen",TNS Infratest Sozialforschung,2014,,"TNS Infratest Sozialforschung. 2014: Erhebungsinstrumente des IAB-SOEP-Migrationssamples 2013: Integrierter Personen-Biografiefragebogen, Haushaltsfragebogen. SOEP Survey Papers 218: Series A. Berlin: DIW/SOEP",36 Infratest Report,SOEP-Core  IAB-SOEP Migration Sample,http://hdl.handle.net/10419/103967,
iab-soep-mig,8631,"Erhebungsinstrumente des IAB-SOEP-Migrationssamples 2013: Übersetzungshilfen (englisch, polnisch, türkisch, rumänisch, russisch)",TNS Infratest Sozialforschung,2014,,"TNS Infratest Sozialforschung. 2014: Erhebungsinstrumente des IAB-SOEP-Migrationssamples 2013: Übersetzungshilfen (englisch, polnisch, türkisch, rumänisch, russisch). SOEP Survey Papers 219: Series A. Berlin: DIW/SOEP",36 Infratest Report,"SOEP-Core,  IAB-SOEP Migration Sample",http://hdl.handle.net/10419/103961,
iab-soep-mig,8699,Neue Muster der Migration,"Herbert Brücker, Ingrid Tucci, Simone Bartsch, Martin Kroh, Parvati Trübswetter, Jürgen Schupp",2014,"Über die Migrationsbiografien, -wege und -erfahrungen der in Deutschland lebenden Zuwanderer gibt es bislang nur wenig gesicherte wissenschaftliche Erkenntnisse. Eine im Jahr 2013 begonnene Längsschnittstudie soll diese Lücke schließen: Für die neue IAB-SOEP-Migrationsstichprobe werden künftig jedes Jahr 5 000 Personen mit Migrationshintergrund und ihre Familienangehörigen befragt. So lässt sich nachvollziehen, wann die Befragten in Deutschland, in ihren Geburtsländern und in anderen Ländern gelebt haben und auf welchen Wegen sie gewandert sind. Traditionelle Muster der Migration, in denen Zuwanderer nach dem Zuzug dauerhaft ihren Lebensmittelpunkt in ein neues Zielland verlagern, werden zunehmend durch neue Muster abgelöst: Insbesondere seit der Wirtschafts- und Finanzkrise sowie der EU-Osterweiterung ist zu beobachten, dass Menschen wiederholt migrieren und Lebenserfahrungen in verschiedenen Ländern sammeln.                     There is as yet little scientific knowledge about the migration biographies, routes, and experiences of immigrants living in Germany. But a longitudinal study started in 2013 is to close this gap. Each year, 5,000 people with a migration background and their family members are surveyed for the new IAB-SOEP Migration Sample. Thus, it can be verified when the respondents have lived in Germany, in their countries of birth, and in other countries, and which routes they migrated along. Traditional migration patterns in which migrants permanently spend their lives in a new destination country after moving there are increasingly being replaced by new patterns: particularly since the economic and financial crisis and the EU's eastern enlargement, it has been observed that people migrate repeatedly and gain life experiences in different countries.","Herbert Brücker, Ingrid Tucci, Simone Bartsch, Martin Kroh, Parvati Trübswetter, Jürgen Schupp. 2014: Neue Muster der Migration. DIW Wochenbericht 81 (43), 1126-1135",05 DIW Weekly Report,"IAB-SOEP Migration Sample, IEB",http://www.diw.de/documents/publikationen/73/diw_01.c.485494.de/14-43-2.pdf,
iab-soep-mig,8700,Migranten investieren in Sprache und Bildung,"Elisabeth Liebau, Agnese Romiti",2014,"Sprachkompetenz und Bildung sind Schlüsselfaktoren für die Teilhabe von Migranten an allen Bereichen des wirtschaftlichen und sozialen Lebens. Ob es Zuwanderern gelingt, ihr im Ausland erworbenes Humankapital nach Deutschland zu transferieren, zeigen erste Ergebnisse aus der IAB-SOEP-Migrationsstichprobe. Lückenlose Bildungsbiografien der Migranten in Deutschland und in den Herkunftsländern machen deutlich, dass diese auch nach dem Zuzug ihre Deutschkenntnisse deutlich verbessern und in erheblichem Umfang berufliche Bildungsabschlüsse erwerben. Bislang hat ein Drittel der Zuwanderer die Anerkennung von ausländischen Berufsabschlüssen beantragt, die Anerkennungsquoten sind bei Migranten, die in reglementierten Berufen tätig sind, besonders hoch.                 Language skills and education are key factors for migrants being able to participate in all areas of economic and social life. Initial findings from the IAB-SOEP Migration Sample are starting to show whether immigrants are successful in transferring the human capital they have acquired abroad to Germany. Complete educational biographies of migrants in Germany and in the countries of origin make it clear that they also significantly improve their German skills after arrival and many acquire professional qualifications. To date, one-third of immigrants has applied for recognition of foreign professional qualifications. The recognition ratios are particularly high among migrants who work in regulated professions.","Elisabeth Liebau, Agnese Romiti. 2014: Migranten investieren in Sprache und Bildung. DIW Wochenbericht 81 (43), 1136-1143",05 DIW Weekly Report,IAB-SOEP Migration Sample,http://www.diw.de/documents/publikationen/73/diw_01.c.485496.de/14-43-3.pdf,
iab-soep-mig,8701,Anerkannte Abschlüsse und Deutschkenntnisse lohnen sich,"Herbert Brücker, Elisabeth Liebau, Agnese Romiti, Ehsan Vallizadeh",2014,"Über die Erwerbsverläufe und die Verdienste von Migranten vor dem Zuzug nach Deutschland ist bislang aufgrund der Datenlage wenig bekannt. Die neue IAB-SOEP-Migrationsstichprobe schließt nicht nur diese Lücke, sie stellt auch umfassende Informationen zu den Determinanten der Arbeitsmarktintegration von Migranten in Deutschland bereit. Menschen, die bereits vor dem Zuzug erwerbstätig waren, sind dies in der Regel auch später in Deutschland und ihre Einkommensgewinne sind hoch. Deutschkenntnisse und die Anerkennung beruflicher Abschlüsse erhöhen die Löhne und steigern die Chancen, entsprechend der Qualifikation beschäftigt zu werden.                Little is currently known about the employment histories and earnings of migrants prior to migration to Germany. Not only does the new IAB-SOEP Migration Sample close this gap but it also provides comprehensive information about the determinants of labor market integration of immigrants in Germany. People who were employed prior to arrival are frequently also subsequently employed in Germany and their income gains are usually high. Knowledge of German and having professional qualifications recognized raises wages and increases the chances of being employed according to the level of qualification.","Herbert Brücker, Elisabeth Liebau, Agnese Romiti, Ehsan Vallizadeh. 2014: Anerkannte Abschlüsse und Deutschkenntnisse lohnen sich. DIW Wochenbericht 81 (43), 1144-1151",05 DIW Weekly Report,IAB-SOEP Migration Sample,http://www.diw.de/documents/publikationen/73/diw_01.c.485498.de/14-43-4.pdf,
iab-soep-mig,8702,Wie zufrieden sind Migranten mit ihrem Leben?,"Ingrid Tucci, Philipp Eisnecker, Herbert Brücker",2014,"Migration stellt die betroffenen Personen vor zahlreiche Herausforderungen. Dazu gehört nicht nur die Arbeitsmarktintegration oder der Erwerb von Sprachkompetenz. Sie müssen auch neue soziale Kontakte in einem fremden Lebensumfeld aufbauen. Mit der IAB-SOEP-Migrationsstichprobe kann die soziale Integration von Migrantinnen und Migranten vertieft untersucht werden. Dabei spielen auch Integrationshemmnisse und Diskriminierungserfahrungen eine zentrale Rolle. Die Ergebnisse zeigen, dass die Lebenszufriedenheit von Migranten, aber auch ihre Identifikation mit Deutschland neben strukturellen Faktoren wie Erwerbsstatus und Einkommen maßgeblich von der sozialen Integration beeinflusst werden.                                      Migration poses many challenges for those involved. This not only includes labor market integration or the acquisition of language skills, they must also establish new social contacts in a foreign living environment. The IAB-SOEP Migration Sample allows us to study this social integration by migrants in greater detail. Barriers to integration and discrimination also play a key role here. The findings show that both the life satisfaction of immigrants and their identification with Germany, as well as structural factors such as employment status and income, are significantly influenced by social integration.","Ingrid Tucci, Philipp Eisnecker, Herbert Brücker. 2014: Wie zufrieden sind Migranten mit ihrem Leben? DIW Wochenbericht 81 (43), 1152-1158",05 DIW Weekly Report,"IAB-SOEP Migration Sample, SOEP-Core",http://www.diw.de/documents/publikationen/73/diw_01.c.485500.de/14-43-5.pdf,
iab-soep-mig,8753,Kinder mit Migrationshintergrund in Kindertageseinrichtungen und Horten: Unterschiede zwischen den Gruppen nicht vernachlässigen!,"Frauke Peter, C. Katharina Spieß",2015,"Der Besuch einer Kindertageseinrichtung oder eines Hortes kann für Kinder mit Migrationshintergrund einen wichtigen Bestandteil der Integration und Teilhabe an der deutschen Gesellschaft darstellen. Von zahlreichen Experten wird in diesem Kontext bemängelt, dass ""Migrantenkinder"" in Kindertageseinrichtungen unterrepräsentiert sind. Auf Basis der neuen IAB-SOEP-Migrantenstichprobe und der aktuellen SOEP-Daten untersucht dieser Bericht erstmals die Inanspruchnahme von Kindertageseinrichtungen in Migrantenfamilien unter Berücksichtigung unterschiedlicher Migrationsabgrenzungen und Integrationsindikatoren. Die Analysen bestätigen, dass insbesondere Kinder, deren Eltern beide einen Migrationshintergrund haben, unterrepräsentiert sind. Unterscheidungen nach dem Herkunftsland der Mutter zeigen jedoch auch, dass dies nur auf Kinder bestimmter Herkunftsgruppen zutrifft. Nach Auskunft der Mütter spricht ein beträchtlicher Anteil der Kindergartenkinder mit Migrationshintergrund zu Hause kein Deutsch – obwohl diese Kinder in der Mehrheit Mütter haben, die beabsichtigen in Deutschland zu bleiben. Außerdem weisen die Analysen einmal mehr darauf hin, dass die Zusammenhänge zwischen Migration und Nutzung von Kindertageseinrichtungen auch durch andere Faktoren, wie die Bildung der Eltern oder die mütterliche Erwerbstätigkeit, erklärbar sind.                    For children with a migration background, attending a daycare or after-school center can be an important part of integration and participation in German society. As a result, many experts are critical that “migrant children” are underrepresented in daycare centers. Based on the latest IAB-SOEP Migration Sample and current SOEP data, the present report examines, for the first time, the uptake of center based daycare by migrant families, taking into account various migration differentiations and integration indicators. The analyses confirm that particularly children from families in which both parents have a migration background are underrepresented. However, when distinguishing according to the mother’s country of origin, it becomes clear that this only applies to children from certain groups of origin. According to information provided by the mothers, a significant proportion of children with a migration background between three years and compulsory school age do not speak German at home - despite these children having mothers who intend to stay in Germany. In addition, the analyses once again indicate that links between migration and center based daycare uptake can be explained by other factors, such as parents’ education or maternal employment.","Frauke Peter, C. Katharina Spieß. 2015: Kinder mit Migrationshintergrund in Kindertageseinrichtungen und Horten: Unterschiede zwischen den Gruppen nicht vernachlässigen! DIW Wochenbericht 82 (1-2), 12-21",05 DIW Weekly Report,IAB-SOEP Migration Sample,http://www.diw.de/documents/publikationen/73/diw_01.c.494153.de/15-1-3.pdf,
iab-soep-mig,8940,"Erhebungsinstrumente des IAB-SOEP-Migrationssamples 2014: Integrierter Personen-Biografiefragebogen, Haushaltsfragebogen",TNS Infratest Sozialforschung,2014,,"TNS Infratest Sozialforschung. 2014: Erhebungsinstrumente des IAB-SOEP-Migrationssamples 2014: Integrierter Personen-Biografiefragebogen, Haushaltsfragebogen. SOEP Survey Papers 259: Series A. Berlin: DIW/SOEP",36 Infratest Report,SOEP-Core  IAB-SOEP Migration Sample,http://hdl.handle.net/10419/106432,
iab-soep-mig,8941,Erhebungsinstrumente des IAB-SOEP-Migrationssamples 2014: Jugendfragebogen,TNS Infratest Sozialforschung,2015,,TNS Infratest Sozialforschung. 2015: Erhebungsinstrumente des IAB-SOEP-Migrationssamples 2014: Jugendfragebogen. SOEP Survey Papers 262: Series A. Berlin: DIW/SOEP,36 Infratest Report,SOEP-Core  IAB-SOEP Migration Sample,http://hdl.handle.net/10419/107015 http://panel.gsoep.de/soep-docs/surveypapers/diw_ssp0262.pdf,
iab-soep-mig,8942,"Erhebungsinstrumente des IAB-SOEP-Migrationssamples 2014: Übersetzungshilfen (englisch, polnisch, türkisch, rumänisch, russisch)",TNS Infratest Sozialforschung,2014,,"TNS Infratest Sozialforschung. 2014: Erhebungsinstrumente des IAB-SOEP-Migrationssamples 2014: Übersetzungshilfen (englisch, polnisch, türkisch, rumänisch, russisch). SOEP Survey Papers 268: Series A. Berlin: DIW/SOEP",36 Infratest Report,"SOEP-Core , IAB-SOEP Migration Sample",http://hdl.handle.net/10419/109642,
iab-soep-mig,8943,Flowcharts for the Integrated Individual-Biography Questionnaire of the IAB-SOEP Migration Sample 2013,Klaudia Erhardt,2015,,Klaudia Erhardt. 2015: Flowcharts for the Integrated Individual-Biography Questionnaire of the IAB-SOEP Migration Sample 2013. SOEP Survey Papers 261: Series C. Berlin: DIW/SOEP,35 Other DIW Publication,SOEP-Core  IAB-SOEP Migration Sample,http://hdl.handle.net/10419/107014 http://panel.gsoep.de/soep-docs/surveypapers/diw_ssp0261.pdf,
iab-soep-mig,8944,"How to Generate Spell Data from Data in ""Wide"" Format - Based on the Migration Biographies of the IAB-SOEP Migration Sample",Klaudia Erhardt,2014,,"Klaudia Erhardt. 2014: How to Generate Spell Data from Data in ""Wide"" Format - Based on the Migration Biographies of the IAB-SOEP Migration Sample. SOEP Survey Papers 228: Series G. Berlin: DIW Berlin",35 Other DIW Publication,SOEP-Core  IAB-SOEP Migration Sample,http://hdl.handle.net/10419/105001 http://panel.gsoep.de/soep-docs/surveypapers/diw_ssp0228.pdf,
iab-soep-mig,9135,The 2013 IAB-SOEP Migration Sample (M1): Sampling Design and Weighting Adjustment,"Martin Kroh, Simon Kühne, Jan Goebel, Friederike Preu",2015,,"Martin Kroh, Simon Kühne, Jan Goebel, Friederike Preu. 2015: The 2013 IAB-SOEP Migration Sample (M1): Sampling Design and Weighting Adjustment. SOEP Survey Papers 271: Series C. Berlin: DIW/SOEP",35 Other DIW Publication,SOEP-Core  IAB-SOEP Migration Sample,http://hdl.handle.net/10419/115868,
iab-soep-mig,9162,Arbeitsmarktintegration: spielt der Geburtsort eine Rolle? - Eine empirische Untersuchung mit Daten des SOEP zum Zusammenhang zwischen Geburtsort und Arbeitsmarkterfolg von Migranten in Deutschland,Michael Kostmann,2015,"Der Arbeitsmarkterfolg von Migranten in Deutschland bleibt trotz Integrationsbemühungen hinter dem der autochthonen deutschen Bevölkerung zurück. Mithilfe der IAB-SOEP Migrationsstichprobe 2013 wurden, nach Herkunftsgruppen differenziert, Unterschiede zwischen der ersten und zweiten Migrantengeneration bezüglich des Arbeitsmarkterfolgs, operationalisiert durch Erwerbsstatus, Arbeitslosigkeit und Einkommen, betrachtet. Die Analyse der gesamten Stichprobe zeigt, dass die zweite Generation lediglich bezüglich des Einkommens besser gestellt ist. In einer Teilstichprobe, die nur Personen enthält, die ihren höchsten Berufs- oder Bildungsabschluss in Deutschland erhoben haben, ist hingegen die erste Generation hinsichtlich Erwerbsstatus und Arbeitslosigkeit besser gestellt. Lineare und logistische Regressionsanalysen in der Teilstichprobe zeigen keinen signifikanten Effekt des Geburtsortes auf das Einkommen, jedoch einen unerwarteten Effekt auf die Erwerbstätigkeit: Personen mit deutschem Abschluss, die in Deutschland geboren sind (zweite Migrantengeneration), haben eine signifikant geringere Wahrscheinlichkeit erwerbstätig zu sein. Insgesamt wird deutlich, dass eine differenzierte Betrachtung der Migrantenbevölkerung auch unabhängig vom Vergleich zu autochthonen deutschen Bevölkerung sinnvoll und nötig ist.                              Despite of integration efforts, the labor market success of migrants in Germany still lags behind that of the autochthonous German population. Using the IAB-SOEP-Migration Sample 2013, differences between first- and second-generation immigrants in Germany regarding labor market success were investigated. For the analysis, the sample was subdivided into groups based on the country of origin. Labor market success was operationalized through employment status, unemployment and income. The analysis of the whole sample indicates, that the second-generation was only better off regarding income. In a subsample, based only on persons who acquired their highest professional or educational degree in Germany, however, the first generation was better off regarding employment status and unemployment. Linear and logistical regression analyses in the subsample indicated no significant effect of the birth1 place on income, but a surprising effect on employment: persons with a German degree, who are born in Germany (second-generation migrants), have a significantly lower probability of being employed. Overall, the need for a differentiated evaluation of the German migrant population also without a comparison to the autochthonous German population seems to be useful and necessary.",Michael Kostmann. 2015: Arbeitsmarktintegration: spielt der Geburtsort eine Rolle? - Eine empirische Untersuchung mit Daten des SOEP zum Zusammenhang zwischen Geburtsort und Arbeitsmarkterfolg von Migranten in Deutschland. SOEPpapers 759. Berlin: DIW Berlin,32 SOEPpaper,"SOEP, IAB-SOEP Migration Sample , SOEP-Core",http://www.diw.de/documents/publikationen/73/diw_01.c.506152.de/diw_sp0759.pdf,
iab-soep-mig,9313,Migration und Finanzkrise - Eine quantitative und strukturelle Analyse der Umlenkung von Wanderungsströmen,Herbert Brücker,2015,"Dieser Beitrag untersucht die Auswirkungen der Finanz- und Wirtschaftskrise auf die Migration in Europa und nach Deutschland. Die Krise hat weniger einen Anstieg der Migration aus den unmittelbar betroffenen Ländern als vielmehr eine Umlenkung der Migrationsströme aus den neuen Mitgliedsstaaten der EU in prosperierende Länder wie Deutschland bewirkt. Neue Schätzverfahren, die systematisch den Einfluss wirtschaftlicher Variablen in alternativen Zielländern berücksichtigen, zeigen, dass der überwiegende Anteil des Anstiegs der Migration nach Deutschland auf die Verschlechterung der wirtschaftlichen Bedingungen in anderen Zielländern zurückzuführen ist. Weiterhin zeigen neue Mikrodaten aus der IAB-SOEP-Migrationsstichprobe, dass der Anteil von Personen, die nicht aus ihrem Geburtsland zuwandern, an den Zuzügen seit Beginn der Krise signifikant gestiegen ist. Der Anteil der Personen, der vor dem Zuzug erwerbslos war, hat im Zuge der Krise nicht zugenommen. Allerdings hat sich die durchschnittliche berufliche Qualifikation verschlechtert.                   This paper analyzes the impact of the financial and economic crisis on migration within Europe and towards Germany. The crisis has triggered a diversion of migration flows from the new EU Member States to prospering countries such as Germany rather than a large increase of migration from the mainly affected countries. Novel estimation procedures, which consider systematically conditions in alternative destinations, show that the overwhelming share of the migration surge in Germany can be attributed to the deterioration of economic conditions in alternative destinations. Furthermore, micro data from the new IAB-SOEP migration sample demonstrate that the share of individuals who did not immigrate from their birth countries in all arrivals has significantly increased since the begin of the crisis. The share of individuals, who have been non-employed before their arrival in Germany, has not increased in the course of the crisis. However, average education levels of new arrivals have declined.","Herbert Brücker. 2015: Migration und Finanzkrise - Eine quantitative und strukturelle Analyse der Umlenkung von Wanderungsströmen. Kölner Zeitschrift für Soziologie und Sozialpsychologie (KZfSS) 67 (1), 165-191",02 SSCI Journal,IAB-SOEP Migration Sample,,10.1007/s11577-015-0320-y
iab-soep-mig,9474,Ausgewählte Analysen zum Zusammenhang von Migration und Teilhabe,"C. Katharina Spieß, Sabine Walper, Martin Diewald",2016,,"C. Katharina Spieß, Sabine Walper, Martin Diewald. 2016: Ausgewählte Analysen zum Zusammenhang von Migration und Teilhabe, in Wissenschaftlicher Beirat für Familienfragen (ed^.), Migration und Familie: Kindheit mit Zuwanderungshintergrund. Wiesbaden: Springer VS. 129-180",20 Book Section,"SOEP, FiD, IAB-SOEP, pairfam, AID , SOEP-Core",,
iab-soep-mig,9505,SOEP 2014 – Methodenbericht zum Befragungsjahr 2014 (Welle 2) des IAB-SOEP-Migrationssamples 2013 (M1),"Axel Glemser, Simon Huber",2016,,"Axel Glemser, Simon Huber. 2016: SOEP 2014 – Methodenbericht zum Befragungsjahr 2014 (Welle 2) des IAB-SOEP-Migrationssamples 2013 (M1). SOEP Survey Papers 301: Series B - Survey Reports (Methodenberichte). Berlin: DIW Berlin",35 Other DIW Publication,SOEP-Core  IAB-SOEP Migration Sample,http://hdl.handle.net/10419/129127,
iab-soep-mig,9529,Feeling European: an exploration of ethnic disparities among immigrants,"Céline Teney, Laurie Hanquinet, Katharina Bürkin",2016,"Over the last 20 years, European identity has become a key topic widely investigated in social sciences. However, most research has only focused on EU nationals and EU immigrants, neglecting the fact that a substantial segment of citizens in Europe are non-EU immigrants. This article explores the differences between and within EU and non-EU immigrant groups in terms of European identity and potential factors behind these differences. Based on the 2013 IAB-SOEP Migration Sample of first generation immigrants in Germany (N = 2581), this paper reveals that non-EU immigrants tend to identify as European – even if to a lesser extent than EU immigrants. Moreover it provides a systematic comparative exploration of different factors possibly able to foster a European identity among EU and non-EU immigrants. It reveals, for instance, that religious affiliation has no significant impact but that spatial mobility is especially important in accounting for patterns in ethnic disparities in the endorsement of a European identity. Furthermore, this article illuminates a positive association between European identity and identity with the receiving society among both EU and non-EU immigrants as well as a positive association between European identity and identification with the origin country among EU immigrants.","Céline Teney, Laurie Hanquinet, Katharina Bürkin. 2016: Feeling European: an exploration of ethnic disparities among immigrants. Journal of Ethnic and Migration Studies 42 (13), 2182-2204",02 SSCI Journal,IAB-SOEP Migration Sample,,10.1080/1369183X.2016.1166941
iab-soep-mig,9679,Determinants of self-employment among Polish and Romanian immigrants in Germany,"Marek Szarucki, Jan Brzozowski, Jelena Stankevičienė",2016,"This empirical study investigates the determinants of self-employment propensity of Polish and Romanian immigrants in Germany. The German economy is an important object of analysis, as it is the most important destination for international migrants in the European Union. In the paper, we use the recently collected M sample of the German Socio-Economic Panel to examine which personal, country of birth-specific socio-economic and cultural factors influence the self-employment propensity of immigrants. The results of binominal logit regression show that the Central European migrants exhibit different self-employment propensity than migrants from former Yugoslavia, Russian and Kazakhstan, Turkey and Italy, with the self-employment aversion especially strong among Romanians. These differences remain substantial even after controlling for social and human capital endowment of the individuals. This study offers important policy recommendations, showing the potential obstacles in encouraging entrepreneurial activity of immigrants. This topic is becoming increasingly important with the current migration crisis in the EU, caused by intensive inflow of asylum-seeking foreigners in 2015.","Marek Szarucki, Jan Brzozowski, Jelena Stankevičienė. 2016: Determinants of self-employment among Polish and Romanian immigrants in Germany. Journal of Business Economics and Management 17 (4), 598-612",02 SSCI Journal,"IAB-SOEP Migration Sample 2013, SOEP v30",,10.3846/16111699.2016.1202313
